{
  "schemaVersion": 1,
  "platformVersion": "2.4.0",
  "releaseId": "01J8QK3F9G7XA6P0V6ZC9N6R4T",
  "k3sVersion": "v1.30.4+k3s1",
  "k3sBinaryUrl": "https://github.com/k3s-io/k3s/releases/download/v1.30.4+k3s1/k3s",
  "k3sBinaryDigest": "sha256:7be67c83afcc03d8608a5a06f9180e71c95585fe249465888e8363a9a9e132b5",
  "chartRepository": "oci://registry.example.com/zon-platform",
  "chartName": "zon",
  "chartVersion": "2.4.0",
  "crdsUrl": "https://releases.example.com/zon/2.4.0/argo-crds.yaml",
  "crdsDigest": "sha256:ebd18182ec39993e96b6da4b8ce1aa3944db1d02dd7f6be4f6e28d316643ec71",
  "configurationUrl": "https://releases.example.com/zon/2.4.0/values.yaml",
  "configurationDigest": "sha256:b7d64a9221007dfd5390f7df6cd5b8f3ea4f82faa1237141e35ebf161f5511a1",
  "argoVersion": "3.5.2",
  "supportedUpgradeSources": [
    "2.3.0",
    "2.3.1"
  ],
  "services": {
    "zon-core": "2.4.0",
    "zon-api": "1.9.2",
    "zon-ui": "1.4.0",
    "zon-registry": "1.1.0",
    "zon-observability": "1.0.3",
    "zon-agent": "1.2.1"
  },
  "enabledComponents": [
    "zon-core",
    "zon-api",
    "zon-ui",
    "zon-observability"
  ]
}